{
  "schema": "avd-assess-security-review/v1",
  "checked": "2026-10-27",
  "pins": {
    "avd-landing-zone": "810c2892c4e2f384ceea62d4c702af992a35be5e",
    "avd-entra": "3a6132c2146a58a7c5feb44cbeab3581d750d3fc",
    "avd-intune": "f64c56a84f7f53bcb7aeb398a456e0853d877633",
    "avd-m365": "f18b14f9866cce604b92738c92afa390e14ee7fc",
    "avd-azure": "ac01bc41b1e60d04bdfc01f77fe7832255d6644c",
    "avd-power-platform": "454335695e8db154dd71550788e1ce3694b59e7e",
    "avd-current-state": "f914918d939a8395ea2db4e6dc500409821f3353",
    "avd-second-brain": "f59a1c5207f89ba71f4752fe2a52a091ca6fd376",
    "avd-swarm": "c81fbcbda8d6a268f66bec24381aac76850a5c2c",
    "avd-ops": "753f62b60e808efcff5654a0c22b2ebbe3eb3676"
  },
  "maturity": {
    "source": {
      "repo": "avd-ops",
      "path": "docs/roadmap-spec.md#6-proven-pre-beta-and-design",
      "kind": "doc",
      "url": "https://github.com/avd-ops/avd-ops/blob/753f62b60e808efcff5654a0c22b2ebbe3eb3676/docs/roadmap-spec.md#6-proven-pre-beta-and-design"
    },
    "repos": {
      "avd-landing-zone": "proven",
      "avd-entra": "pre-beta",
      "avd-intune": "pre-beta",
      "avd-m365": "pre-beta",
      "avd-azure": "pre-beta",
      "avd-power-platform": "pre-beta",
      "avd-current-state": "proven",
      "avd-assess": "pre-beta",
      "avd-second-brain": "pre-beta",
      "avd-ops": "pre-beta",
      "avd-swarm": "design"
    }
  },
  "standards": {
    "method": "methods/security.md",
    "scope": "gap:security-scope",
    "pillars": [
      "security-posture",
      "identity",
      "networking-azure",
      "networking-client",
      "protocol",
      "endpoint-protection",
      "intune",
      "governance"
    ],
    "references": [
      "ref:avd-security-guide",
      "ref:mcsb-avd-baseline",
      "ref:zero-trust-avd",
      "ref:review-checklists-avd",
      "ref:windows-security-baselines",
      "ref:intune-security-baselines",
      "ref:rdp-properties",
      "ref:screen-capture-protection",
      "ref:watermarking",
      "ref:defender-compute-recommendations",
      "ref:avd-private-link",
      "ref:bastion",
      "ref:psrule-azure"
    ]
  },
  "areas": [
    {
      "id": "identity-access",
      "title": "Identity and access",
      "pillars": [
        "identity",
        "security-posture"
      ],
      "claims": [
        {
          "id": "lz-deploy-owner",
          "repo": "avd-landing-zone",
          "says": "Deploying needs Owner on a dedicated subscription, because the template creates role and policy assignments; the post-deployment admin consent needs Cloud Application Administrator or Application Administrator.",
          "standing": "built",
          "evidence": [
            {
              "repo": "avd-landing-zone",
              "path": "docs/deploy.md#1-prerequisites",
              "kind": "doc",
              "url": "https://github.com/avd-ops/avd-landing-zone/blob/810c2892c4e2f384ceea62d4c702af992a35be5e/docs/deploy.md#1-prerequisites"
            },
            {
              "repo": "avd-landing-zone",
              "path": "bicep/modules/governance.bicep",
              "kind": "code",
              "url": "https://github.com/avd-ops/avd-landing-zone/blob/810c2892c4e2f384ceea62d4c702af992a35be5e/bicep/modules/governance.bicep"
            }
          ]
        },
        {
          "id": "lz-ci-oidc",
          "repo": "avd-landing-zone",
          "says": "GitHub Actions sign in to Azure with OpenID Connect federated credentials, one exact subject per environment; no Azure secret is stored. The image build identity is federated to the images environment only.",
          "standing": "guarded",
          "evidence": [
            {
              "repo": "avd-landing-zone",
              "path": "docs/ci.md#azure-access-oidc-no-stored-secrets",
              "kind": "doc",
              "url": "https://github.com/avd-ops/avd-landing-zone/blob/810c2892c4e2f384ceea62d4c702af992a35be5e/docs/ci.md#azure-access-oidc-no-stored-secrets"
            },
            {
              "repo": "avd-landing-zone",
              "path": ".github/workflows/deploy.yml",
              "kind": "code",
              "url": "https://github.com/avd-ops/avd-landing-zone/blob/810c2892c4e2f384ceea62d4c702af992a35be5e/.github/workflows/deploy.yml"
            },
            {
              "repo": "avd-landing-zone",
              "path": "build/tests/Template.Tests.ps1#L159",
              "kind": "test",
              "url": "https://github.com/avd-ops/avd-landing-zone/blob/810c2892c4e2f384ceea62d4c702af992a35be5e/build/tests/Template.Tests.ps1#L159"
            }
          ],
          "note": "The optional break-glass password can be a repository secret for CI; unset, deploy.sh generates one."
        },
        {
          "id": "lz-graph-delegated",
          "repo": "avd-landing-zone",
          "says": "Scripts reach Microsoft Graph as the signed-in person through a public client app with delegated permissions, no secret or certificate, assignment required. Every purpose signs in with one union of scopes, which includes write scopes even for a read-only preflight.",
          "standing": "guarded",
          "evidence": [
            {
              "repo": "avd-landing-zone",
              "path": "build/decisions/0016-graph-operator-app.md",
              "kind": "decision",
              "url": "https://github.com/avd-ops/avd-landing-zone/blob/810c2892c4e2f384ceea62d4c702af992a35be5e/build/decisions/0016-graph-operator-app.md"
            },
            {
              "repo": "avd-landing-zone",
              "path": "scripts/ops/AvdLandingZone.psm1#L295",
              "kind": "code",
              "url": "https://github.com/avd-ops/avd-landing-zone/blob/810c2892c4e2f384ceea62d4c702af992a35be5e/scripts/ops/AvdLandingZone.psm1#L295"
            },
            {
              "repo": "avd-landing-zone",
              "path": "build/tests/AvdLandingZone.Tests.ps1#L177",
              "kind": "test",
              "url": "https://github.com/avd-ops/avd-landing-zone/blob/810c2892c4e2f384ceea62d4c702af992a35be5e/build/tests/AvdLandingZone.Tests.ps1#L177"
            },
            {
              "repo": "avd-landing-zone",
              "path": "docs/operations.md#L68",
              "kind": "doc",
              "url": "https://github.com/avd-ops/avd-landing-zone/blob/810c2892c4e2f384ceea62d4c702af992a35be5e/docs/operations.md#L68"
            }
          ],
          "note": "The operations docs state the trade-off for reviewers; there is no read-only scope set, and a reviewer who needs one runs the check with reader roles only."
        },
        {
          "id": "lz-break-glass",
          "repo": "avd-landing-zone",
          "says": "The hosts' local administrator password is random per deployment unless one is supplied, stored in Key Vault for the hosts that deployment created, and recovered with VM reset password; nobody has to remember it.",
          "standing": "run",
          "evidence": [
            {
              "repo": "avd-landing-zone",
              "path": "build/decisions/0004-random-break-glass.md",
              "kind": "decision",
              "url": "https://github.com/avd-ops/avd-landing-zone/blob/810c2892c4e2f384ceea62d4c702af992a35be5e/build/decisions/0004-random-break-glass.md"
            },
            {
              "repo": "avd-landing-zone",
              "path": "build/lessons/0002-break-glass-password.md",
              "kind": "lesson",
              "url": "https://github.com/avd-ops/avd-landing-zone/blob/810c2892c4e2f384ceea62d4c702af992a35be5e/build/lessons/0002-break-glass-password.md"
            }
          ]
        },
        {
          "id": "lz-rbac",
          "repo": "avd-landing-zone",
          "says": "Built-in roles only, each at the narrowest scope the template knows; users get Desktop Virtualization User and Virtual Machine User Login, admins Virtual Machine Administrator Login and the elevated SMB role, the AVD service Power On Off Contributor, and the shutdown runbook's identity only what its actions need.",
          "standing": "built",
          "evidence": [
            {
              "repo": "avd-landing-zone",
              "path": "bicep/modules/sessionHosts.bicep",
              "kind": "code",
              "url": "https://github.com/avd-ops/avd-landing-zone/blob/810c2892c4e2f384ceea62d4c702af992a35be5e/bicep/modules/sessionHosts.bicep"
            },
            {
              "repo": "avd-landing-zone",
              "path": "bicep/modules/storage.bicep",
              "kind": "code",
              "url": "https://github.com/avd-ops/avd-landing-zone/blob/810c2892c4e2f384ceea62d4c702af992a35be5e/bicep/modules/storage.bicep"
            },
            {
              "repo": "avd-landing-zone",
              "path": "bicep/modules/controlPlane.bicep",
              "kind": "code",
              "url": "https://github.com/avd-ops/avd-landing-zone/blob/810c2892c4e2f384ceea62d4c702af992a35be5e/bicep/modules/controlPlane.bicep"
            },
            {
              "repo": "avd-landing-zone",
              "path": "build/tests/Template.Tests.ps1#L85",
              "kind": "test",
              "url": "https://github.com/avd-ops/avd-landing-zone/blob/810c2892c4e2f384ceea62d4c702af992a35be5e/build/tests/Template.Tests.ps1#L85"
            },
            {
              "repo": "avd-landing-zone",
              "path": "build/tests/Template.Tests.ps1#L599",
              "kind": "test",
              "url": "https://github.com/avd-ops/avd-landing-zone/blob/810c2892c4e2f384ceea62d4c702af992a35be5e/build/tests/Template.Tests.ps1#L599"
            }
          ],
          "note": "The runbook's roles and the three on the hosts resource group have template tests; the storage and control plane assignments are in the code with no test."
        },
        {
          "id": "lz-jumpbox",
          "repo": "avd-landing-zone",